{
  "$schema": "https://json-schema.org/draft/2020-12/schema",
  "$id": "https://p42.world/protocol/typed-transcript/typed-transcript-vectors-v1.schema.json",
  "title": "TypedTranscriptV1 ordered structural vectors",
  "type": "object",
  "additionalProperties": false,
  "required": ["artifactStatus", "cryptographicOutputsIncluded", "protocolId", "version", "positiveTranscripts", "collisionNegativeTranscripts", "rejectionVectors"],
  "properties": {
    "$schema": {"type": "string"},
    "artifactStatus": {"const": "design-only-non-activating"},
    "cryptographicOutputsIncluded": {"const": false},
    "protocolId": {"const": "p42.sp1.typed-transcript"},
    "version": {"const": 1},
    "positiveTranscripts": {"type": "array", "minItems": 1, "items": {"$ref": "#/$defs/transcript"}},
    "collisionNegativeTranscripts": {"type": "array", "minItems": 1, "items": {"$ref": "#/$defs/collisionPair"}},
    "rejectionVectors": {"type": "array", "minItems": 1, "items": {"$ref": "#/$defs/rejection"}}
  },
  "$defs": {
    "word": {"type": "string", "pattern": "^(0|[1-9][0-9]*)$"},
    "profile": {"enum": ["inner-koalabear-v1", "outer-bn254-v1"]},
    "event": {
      "type": "object",
      "additionalProperties": false,
      "required": ["tag", "encoding", "counter", "logicalLength", "payload"],
      "properties": {
        "tag": {"type": "string"},
        "encoding": {"type": "string"},
        "counter": {"type": "integer", "minimum": 0},
        "logicalLength": {"type": "integer", "minimum": 0},
        "payload": {"type": "array", "items": {"$ref": "#/$defs/word"}}
      }
    },
    "stackFrame": {
      "type": "object",
      "additionalProperties": false,
      "required": ["kind", "declaredChildren", "observedChildren"],
      "properties": {
        "kind": {"enum": ["slice", "container"]},
        "declaredChildren": {"type": "integer", "minimum": 0},
        "observedChildren": {"type": "integer", "minimum": 0}
      }
    },
    "snapshot": {
      "type": "object",
      "additionalProperties": false,
      "required": ["mode", "nextCounter", "collectionStack", "permutationStateStatus", "permutationState"],
      "properties": {
        "mode": {"enum": ["uninitialized", "absorbing"]},
        "nextCounter": {"type": "integer", "minimum": 0},
        "collectionStack": {"type": "array", "items": {"$ref": "#/$defs/stackFrame"}},
        "permutationStateStatus": {"enum": ["exact", "not-generated"]},
        "permutationState": {
          "oneOf": [
            {"type": "null"},
            {"type": "array", "items": {"$ref": "#/$defs/word"}}
          ]
        }
      }
    },
    "block": {
      "type": "object",
      "additionalProperties": false,
      "required": ["index", "occupied", "final", "control", "rateWords"],
      "properties": {
        "index": {"type": "integer", "minimum": 0, "maximum": 65535},
        "occupied": {"type": "integer", "minimum": 0},
        "final": {"type": "boolean"},
        "control": {"$ref": "#/$defs/word"},
        "rateWords": {"type": "array", "items": {"$ref": "#/$defs/word"}}
      }
    },
    "step": {
      "type": "object",
      "additionalProperties": false,
      "required": ["index", "transitionKind", "expectedBefore", "expectedFrameWords", "expectedAbsorbBlocks", "expectedSqueezeContinuations", "expectedAfter"],
      "properties": {
        "index": {"type": "integer", "minimum": 0},
        "transitionKind": {"enum": ["absorb", "squeeze"]},
        "expectedBefore": {"$ref": "#/$defs/snapshot"},
        "expectedFrameWords": {"type": "array", "minItems": 1, "items": {"$ref": "#/$defs/word"}},
        "expectedAbsorbBlocks": {"type": "array", "minItems": 1, "items": {"$ref": "#/$defs/block"}},
        "expectedSqueezeContinuations": {"type": "array", "items": {"$ref": "#/$defs/block"}},
        "expectedAfter": {"$ref": "#/$defs/snapshot"}
      }
    },
    "transcript": {
      "type": "object",
      "additionalProperties": false,
      "required": ["id", "profile", "envelopeHex", "expectedInitial", "events", "expectedSteps", "expectedFinal"],
      "properties": {
        "id": {"type": "string", "pattern": "^[a-z0-9][a-z0-9-]*$"},
        "profile": {"$ref": "#/$defs/profile"},
        "envelopeHex": {"type": "string", "pattern": "^0x[0-9a-f]{32}$"},
        "expectedInitial": {"$ref": "#/$defs/snapshot"},
        "events": {"type": "array", "minItems": 2, "items": {"$ref": "#/$defs/event"}},
        "expectedSteps": {"type": "array", "minItems": 2, "items": {"$ref": "#/$defs/step"}},
        "expectedFinal": {"$ref": "#/$defs/snapshot"}
      }
    },
    "collisionPair": {
      "type": "object",
      "additionalProperties": false,
      "required": ["id", "profile", "left", "right", "reason"],
      "properties": {
        "id": {"type": "string", "pattern": "^[a-z0-9][a-z0-9-]*$"},
        "profile": {"$ref": "#/$defs/profile"},
        "left": {"type": "array", "minItems": 2, "items": {"$ref": "#/$defs/event"}},
        "right": {"type": "array", "minItems": 2, "items": {"$ref": "#/$defs/event"}},
        "reason": {"type": "string", "minLength": 1}
      }
    },
    "rejection": {
      "type": "object",
      "additionalProperties": false,
      "required": ["id", "kind", "profile", "envelopeHex", "events", "expectedErrorCode"],
      "properties": {
        "id": {"type": "string", "pattern": "^[a-z0-9][a-z0-9-]*$"},
        "kind": {"enum": ["envelope", "transcript"]},
        "profile": {"$ref": "#/$defs/profile"},
        "envelopeHex": {"type": ["string", "null"]},
        "events": {"type": "array", "items": {"$ref": "#/$defs/event"}},
        "expectedErrorCode": {"type": "string", "pattern": "^[A-Z][A-Z0-9_]*$"}
      }
    }
  }
}
