{
  "$schema": "./typed-transcript-vectors-v1.schema.json",
  "artifactStatus": "design-only-non-activating",
  "cryptographicOutputsIncluded": false,
  "protocolId": "p42.sp1.typed-transcript",
  "version": 1,
  "positiveTranscripts": [
    {
      "id": "inner-ordered-lifecycle",
      "profile": "inner-koalabear-v1",
      "envelopeHex": "0x50343254545631000001010101081000",
      "expectedInitial": {
        "mode": "uninitialized",
        "nextCounter": 0,
        "collectionStack": [],
        "permutationStateStatus": "exact",
        "permutationState": [
          "0",
          "0",
          "0",
          "0",
          "0",
          "0",
          "0",
          "0",
          "0",
          "0",
          "0",
          "0",
          "0",
          "0",
          "0",
          "0"
        ]
      },
      "events": [
        {
          "tag": "protocolInit",
          "encoding": "versionEnvelopeU16",
          "counter": 0,
          "logicalLength": 16,
          "payload": [
            "20532",
            "12884",
            "21590",
            "12544",
            "1",
            "257",
            "264",
            "4096"
          ]
        },
        {
          "tag": "baseField",
          "encoding": "koalaBearDirect",
          "counter": 1,
          "logicalLength": 1,
          "payload": [
            "7"
          ]
        },
        {
          "tag": "containerBegin",
          "encoding": "container",
          "counter": 2,
          "logicalLength": 2,
          "payload": []
        },
        {
          "tag": "sliceBegin",
          "encoding": "container",
          "counter": 3,
          "logicalLength": 2,
          "payload": []
        },
        {
          "tag": "baseField",
          "encoding": "koalaBearDirect",
          "counter": 4,
          "logicalLength": 1,
          "payload": [
            "5"
          ]
        },
        {
          "tag": "extensionField",
          "encoding": "extension4KoalaBearDirect",
          "counter": 5,
          "logicalLength": 1,
          "payload": [
            "1",
            "2",
            "3",
            "4"
          ]
        },
        {
          "tag": "sliceEnd",
          "encoding": "container",
          "counter": 6,
          "logicalLength": 0,
          "payload": []
        },
        {
          "tag": "digest",
          "encoding": "koalaBearDigest8",
          "counter": 7,
          "logicalLength": 1,
          "payload": [
            "1",
            "2",
            "3",
            "4",
            "5",
            "6",
            "7",
            "8"
          ]
        },
        {
          "tag": "containerEnd",
          "encoding": "container",
          "counter": 8,
          "logicalLength": 0,
          "payload": []
        },
        {
          "tag": "squeezeField",
          "encoding": "squeezeRequest",
          "counter": 9,
          "logicalLength": 10,
          "payload": []
        },
        {
          "tag": "squeezeField",
          "encoding": "squeezeRequest",
          "counter": 10,
          "logicalLength": 1,
          "payload": []
        },
        {
          "tag": "baseField",
          "encoding": "koalaBearDirect",
          "counter": 11,
          "logicalLength": 2,
          "payload": [
            "9",
            "0"
          ]
        },
        {
          "tag": "squeezeBits",
          "encoding": "squeezeRequest",
          "counter": 12,
          "logicalLength": 30,
          "payload": []
        }
      ],
      "expectedSteps": [
        {
          "index": 0,
          "transitionKind": "absorb",
          "expectedBefore": {
            "mode": "uninitialized",
            "nextCounter": 0,
            "collectionStack": [],
            "permutationStateStatus": "exact",
            "permutationState": [
              "0",
              "0",
              "0",
              "0",
              "0",
              "0",
              "0",
              "0",
              "0",
              "0",
              "0",
              "0",
              "0",
              "0",
              "0",
              "0"
            ]
          },
          "expectedFrameWords": [
            "1345597953",
            "1",
            "1",
            "10",
            "0",
            "0",
            "0",
            "0",
            "16",
            "0",
            "0",
            "0",
            "8",
            "0",
            "0",
            "0",
            "20532",
            "12884",
            "21590",
            "12544",
            "1",
            "257",
            "264",
            "4096",
            "1162757121"
          ],
          "expectedAbsorbBlocks": [
            {
              "index": 0,
              "occupied": 8,
              "final": false,
              "control": "1084751872",
              "rateWords": [
                "1345597953",
                "1",
                "1",
                "10",
                "0",
                "0",
                "0",
                "0"
              ]
            },
            {
              "index": 1,
              "occupied": 8,
              "final": false,
              "control": "1084751873",
              "rateWords": [
                "16",
                "0",
                "0",
                "0",
                "8",
                "0",
                "0",
                "0"
              ]
            },
            {
              "index": 2,
              "occupied": 8,
              "final": false,
              "control": "1084751874",
              "rateWords": [
                "20532",
                "12884",
                "21590",
                "12544",
                "1",
                "257",
                "264",
                "4096"
              ]
            },
            {
              "index": 3,
              "occupied": 1,
              "final": true,
              "control": "1085341699",
              "rateWords": [
                "1162757121",
                "0",
                "0",
                "0",
                "0",
                "0",
                "0",
                "0"
              ]
            }
          ],
          "expectedSqueezeContinuations": [],
          "expectedAfter": {
            "mode": "absorbing",
            "nextCounter": 1,
            "collectionStack": [],
            "permutationStateStatus": "not-generated",
            "permutationState": null
          }
        },
        {
          "index": 1,
          "transitionKind": "absorb",
          "expectedBefore": {
            "mode": "absorbing",
            "nextCounter": 1,
            "collectionStack": [],
            "permutationStateStatus": "not-generated",
            "permutationState": null
          },
          "expectedFrameWords": [
            "1345597953",
            "1",
            "16",
            "1",
            "1",
            "0",
            "0",
            "0",
            "1",
            "0",
            "0",
            "0",
            "1",
            "0",
            "0",
            "0",
            "7",
            "1162757121"
          ],
          "expectedAbsorbBlocks": [
            {
              "index": 0,
              "occupied": 8,
              "final": false,
              "control": "1084751872",
              "rateWords": [
                "1345597953",
                "1",
                "16",
                "1",
                "1",
                "0",
                "0",
                "0"
              ]
            },
            {
              "index": 1,
              "occupied": 8,
              "final": false,
              "control": "1084751873",
              "rateWords": [
                "1",
                "0",
                "0",
                "0",
                "1",
                "0",
                "0",
                "0"
              ]
            },
            {
              "index": 2,
              "occupied": 2,
              "final": true,
              "control": "1085407234",
              "rateWords": [
                "7",
                "1162757121",
                "0",
                "0",
                "0",
                "0",
                "0",
                "0"
              ]
            }
          ],
          "expectedSqueezeContinuations": [],
          "expectedAfter": {
            "mode": "absorbing",
            "nextCounter": 2,
            "collectionStack": [],
            "permutationStateStatus": "not-generated",
            "permutationState": null
          }
        },
        {
          "index": 2,
          "transitionKind": "absorb",
          "expectedBefore": {
            "mode": "absorbing",
            "nextCounter": 2,
            "collectionStack": [],
            "permutationStateStatus": "not-generated",
            "permutationState": null
          },
          "expectedFrameWords": [
            "1345597953",
            "1",
            "34",
            "7",
            "2",
            "0",
            "0",
            "0",
            "2",
            "0",
            "0",
            "0",
            "0",
            "0",
            "0",
            "0",
            "1162757121"
          ],
          "expectedAbsorbBlocks": [
            {
              "index": 0,
              "occupied": 8,
              "final": false,
              "control": "1084751872",
              "rateWords": [
                "1345597953",
                "1",
                "34",
                "7",
                "2",
                "0",
                "0",
                "0"
              ]
            },
            {
              "index": 1,
              "occupied": 8,
              "final": false,
              "control": "1084751873",
              "rateWords": [
                "2",
                "0",
                "0",